{
  "version": "1.0.0",
  "lastUpdated": "2025-01-22",
  "styles": [
    {
      "id": "minimalist",
      "name": "Minimalist",
      "description": "Clean, whitespace-focused, typography-driven design with purposeful simplicity",
      "mood": "Calm, professional, focused",
      "bestFor": ["SaaS products", "Dashboard applications", "Professional services", "Data-heavy apps"],
      "complexity": "Low",
      "characteristics": [
        "Generous white space",
        "Strong typography hierarchy",
        "Limited color palette",
        "Simple geometric shapes",
        "Subtle interactions"
      ],
      "colorPalette": {
        "primary": "#0F172D",
        "secondary": "#64748B",
        "accent": "#3B82F6",
        "background": "#FFFFFF",
        "surface": "#F8FAFC",
        "border": "#E2E8F0",
        "text": {
          "primary": "#0F172D",
          "secondary": "#475569",
          "muted": "#94A3B8"
        },
        "status": {
          "success": "#10B981",
          "warning": "#F59E0B",
          "error": "#EF4444",
          "info": "#3B82F6"
        }
      },
      "typography": {
        "fontFamily": {
          "heading": "Inter, system-ui, sans-serif",
          "body": "Inter, system-ui, sans-serif"
        },
        "scale": {
          "display": { "size": "64px", "weight": "700", "lineHeight": "1.1" },
          "h1": { "size": "48px", "weight": "700", "lineHeight": "1.2" },
          "h2": { "size": "36px", "weight": "600", "lineHeight": "1.3" },
          "h3": { "size": "30px", "weight": "600", "lineHeight": "1.4" },
          "h4": { "size": "24px", "weight": "600", "lineHeight": "1.5" },
          "body": { "size": "16px", "weight": "400", "lineHeight": "1.5" },
          "small": { "size": "14px", "weight": "400", "lineHeight": "1.5" },
          "caption": { "size": "12px", "weight": "400", "lineHeight": "1.4" }
        }
      },
      "spacing": {
        "baseUnit": "4px",
        "scale": [0, 4, 8, 12, 16, 20, 24, 32, 40, 48, 64, 80, 96]
      },
      "borderRadius": {
        "sm": "4px",
        "md": "6px",
        "lg": "8px",
        "full": "9999px"
      },
      "shadows": {
        "sm": "0 1px 2px 0 rgb(0 0 0 / 0.05)",
        "md": "0 4px 6px -1px rgb(0 0 0 / 0.1)",
        "lg": "0 10px 15px -3px rgb(0 0 0 / 0.1)",
        "xl": "0 20px 25px -5px rgb(0 0 0 / 0.1)"
      },
      "layout": {
        "grid": "12-column grid",
        "containerMaxWidth": "1200px",
        "gutter": "24px",
        "breakpoints": {
          "sm": "640px",
          "md": "768px",
          "lg": "1024px",
          "xl": "1280px"
        }
      }
    },
    {
      "id": "brutalist",
      "name": "Brutalist",
      "description": "Raw, bold, high-contrast design with unconventional layouts and strong visual impact",
      "mood": "Bold, rebellious, confident",
      "bestFor": ["Creative agencies", "Portfolio sites", "Edgy brands", "Artistic projects"],
      "complexity": "Medium",
      "characteristics": [
        "High contrast colors",
        "Bold typography",
        "Visible borders/dividers",
        "Asymmetric layouts",
        "Raw, unpolished aesthetic"
      ],
      "colorPalette": {
        "primary": "#000000",
        "secondary": "#FFFFFF",
        "accent": "#FF0055",
        "background": "#FFFFFF",
        "surface": "#F0F0F0",
        "border": "#000000",
        "text": {
          "primary": "#000000",
          "secondary": "#333333",
          "muted": "#666666"
        },
        "status": {
          "success": "#00FF00",
          "warning": "#FFFF00",
          "error": "#FF0000",
          "info": "#00FFFF"
        }
      },
      "typography": {
        "fontFamily": {
          "heading": "Space Mono, Courier New, monospace",
          "body": "Arial, Helvetica, sans-serif"
        },
        "scale": {
          "display": { "size": "72px", "weight": "900", "lineHeight": "0.9" },
          "h1": { "size": "56px", "weight": "900", "lineHeight": "1" },
          "h2": { "size": "42px", "weight": "900", "lineHeight": "1" },
          "h3": { "size": "32px", "weight": "700", "lineHeight": "1.1" },
          "h4": { "size": "24px", "weight": "700", "lineHeight": "1.2" },
          "body": { "size": "18px", "weight": "400", "lineHeight": "1.4" },
          "small": { "size": "16px", "weight": "400", "lineHeight": "1.4" },
          "caption": { "size": "14px", "weight": "400", "lineHeight": "1.3" }
        }
      },
      "spacing": {
        "baseUnit": "8px",
        "scale": [0, 8, 16, 24, 32, 48, 64, 96, 128]
      },
      "borderRadius": {
        "sm": "0px",
        "md": "0px",
        "lg": "0px",
        "full": "0px"
      },
      "shadows": {
        "sm": "none",
        "md": "8px 8px 0px #000000",
        "lg": "12px 12px 0px #000000",
        "xl": "16px 16px 0px #000000"
      },
      "layout": {
        "grid": "Custom asymmetric grid",
        "containerMaxWidth": "1400px",
        "gutter": "32px",
        "breakpoints": {
          "sm": "640px",
          "md": "768px",
          "lg": "1024px",
          "xl": "1280px"
        }
      }
    },
    {
      "id": "glassmorphism",
      "name": "Glassmorphism",
      "description": "Modern translucent design with blur effects, depth, and layered interfaces",
      "mood": "Modern, futuristic, ethereal",
      "bestFor": ["Tech startups", "SaaS products", "Mobile apps", "Futuristic brands"],
      "complexity": "High",
      "characteristics": [
        "Translucent backgrounds",
        "Backdrop blur effects",
        "Vibrant gradient accents",
        "Floating elements",
        "Subtle borders"
      ],
      "colorPalette": {
        "primary": "#6366F1",
        "secondary": "#8B5CF6",
        "accent": "#EC4899",
        "background": "linear-gradient(135deg, #667eea 0%, #764ba2 100%)",
        "surface": "rgba(255, 255, 255, 0.1)",
        "border": "rgba(255, 255, 255, 0.2)",
        "text": {
          "primary": "#FFFFFF",
          "secondary": "rgba(255, 255, 255, 0.8)",
          "muted": "rgba(255, 255, 255, 0.6)"
        },
        "status": {
          "success": "#10B981",
          "warning": "#F59E0B",
          "error": "#EF4444",
          "info": "#3B82F6"
        }
      },
      "typography": {
        "fontFamily": {
          "heading": "Poppins, system-ui, sans-serif",
          "body": "Inter, system-ui, sans-serif"
        },
        "scale": {
          "display": { "size": "60px", "weight": "700", "lineHeight": "1.2" },
          "h1": { "size": "48px", "weight": "700", "lineHeight": "1.3" },
          "h2": { "size": "38px", "weight": "600", "lineHeight": "1.3" },
          "h3": { "size": "30px", "weight": "600", "lineHeight": "1.4" },
          "h4": { "size": "24px", "weight": "500", "lineHeight": "1.4" },
          "body": { "size": "16px", "weight": "400", "lineHeight": "1.6" },
          "small": { "size": "14px", "weight": "400", "lineHeight": "1.5" },
          "caption": { "size": "12px", "weight": "400", "lineHeight": "1.4" }
        }
      },
      "spacing": {
        "baseUnit": "4px",
        "scale": [0, 4, 8, 12, 16, 20, 24, 32, 40, 48, 64, 80]
      },
      "borderRadius": {
        "sm": "8px",
        "md": "12px",
        "lg": "16px",
        "full": "9999px"
      },
      "shadows": {
        "sm": "0 2px 8px rgba(0, 0, 0, 0.1)",
        "md": "0 8px 32px rgba(0, 0, 0, 0.12)",
        "lg": "0 12px 48px rgba(0, 0, 0, 0.15)",
        "xl": "0 20px 64px rgba(0, 0, 0, 0.2)"
      },
      "effects": {
        "backdropBlur": "blur(20px)",
        "backgroundOpacity": "rgba(255, 255, 255, 0.1)",
        "borderOpacity": "rgba(255, 255, 255, 0.2)"
      },
      "layout": {
        "grid": "12-column grid with floating elements",
        "containerMaxWidth": "1200px",
        "gutter": "24px",
        "breakpoints": {
          "sm": "640px",
          "md": "768px",
          "lg": "1024px",
          "xl": "1280px"
        }
      }
    },
    {
      "id": "neumorphism",
      "name": "Neumorphism",
      "description": "Soft, extruded design with subtle shadows and minimal contrast",
      "mood": "Soft, modern, clean",
      "bestFor": ["Mobile apps", "Smart home interfaces", "Modern tools", "Minimal brands"],
      "complexity": "High",
      "characteristics": [
        "Soft shadows",
        "Extruded shapes",
        "Low contrast",
        "Subtle depth",
        "Rounded corners"
      ],
      "colorPalette": {
        "primary": "#5E6C84",
        "secondary": "#7A869A",
        "accent": "#4C9AFF",
        "background": "#E0E5EC",
        "surface": "#E0E5EC",
        "border": "#E0E5EC",
        "text": {
          "primary": "#2D3748",
          "secondary": "#4A5568",
          "muted": "#718096"
        },
        "status": {
          "success": "#48BB78",
          "warning": "#ECC94B",
          "error": "#F56565",
          "info": "#4299E1"
        }
      },
      "typography": {
        "fontFamily": {
          "heading": "Montserrat, system-ui, sans-serif",
          "body": "Open Sans, system-ui, sans-serif"
        },
        "scale": {
          "display": { "size": "56px", "weight": "600", "lineHeight": "1.2" },
          "h1": { "size": "44px", "weight": "600", "lineHeight": "1.3" },
          "h2": { "size": "36px", "weight": "600", "lineHeight": "1.3" },
          "h3": { "size": "28px", "weight": "500", "lineHeight": "1.4" },
          "h4": { "size": "22px", "weight": "500", "lineHeight": "1.4" },
          "body": { "size": "16px", "weight": "400", "lineHeight": "1.5" },
          "small": { "size": "14px", "weight": "400", "lineHeight": "1.5" },
          "caption": { "size": "12px", "weight": "400", "lineHeight": "1.4" }
        }
      },
      "spacing": {
        "baseUnit": "4px",
        "scale": [0, 4, 8, 12, 16, 20, 24, 32, 40, 48, 64]
      },
      "borderRadius": {
        "sm": "12px",
        "md": "16px",
        "lg": "20px",
        "full": "9999px"